{
  "$schema": "https://json-schema.org/draft/2020-12/schema",
  "$id": "https://marked-bench.local/schemas/submission_bundle.schema.json",
  "title": "The Marked Bench Submission Bundle",
  "type": "object",
  "required": [
    "schema",
    "created_at",
    "submission_path",
    "report_path",
    "prediction_path",
    "system_name",
    "system_version",
    "submitter",
    "suite_id",
    "suite_version",
    "suite_hash",
    "report_sha256",
    "overall_score",
    "files",
    "review_checklist",
    "notes"
  ],
  "properties": {
    "schema": {
      "const": "marked_bench.leaderboard-submission-bundle.v1"
    },
    "created_at": {
      "type": "number"
    },
    "submission_path": {
      "type": "string",
      "minLength": 1
    },
    "report_path": {
      "type": "string",
      "minLength": 1
    },
    "prediction_path": {
      "type": [
        "string",
        "null"
      ]
    },
    "system_name": {
      "type": "string",
      "minLength": 1
    },
    "system_version": {
      "type": "string",
      "minLength": 1
    },
    "submitter": {
      "type": "string",
      "minLength": 1
    },
    "suite_id": {
      "enum": [
        "marked-bench-contradiction-standard",
        "marked-bench-contradiction-adversarial",
        "marked-bench-contradiction-multihop"
      ]
    },
    "suite_version": {
      "enum": [
        "0.1.0",
        "0.2.0",
        "0.3.0"
      ]
    },
    "suite_hash": {
      "type": "string",
      "pattern": "^[a-fA-F0-9]{64}$"
    },
    "report_sha256": {
      "type": "string",
      "pattern": "^[a-fA-F0-9]{64}$"
    },
    "overall_score": {
      "type": "number",
      "minimum": 0,
      "maximum": 100
    },
    "files": {
      "type": "array",
      "minItems": 2,
      "items": {
        "type": "object",
        "required": [
          "role",
          "path",
          "sha256",
          "bytes"
        ],
        "properties": {
          "role": {
            "enum": [
              "submission",
              "report",
              "predictions"
            ]
          },
          "path": {
            "type": "string",
            "minLength": 1
          },
          "sha256": {
            "type": "string",
            "pattern": "^[a-fA-F0-9]{64}$"
          },
          "bytes": {
            "type": "integer",
            "minimum": 0
          }
        }
      }
    },
    "review_checklist": {
      "type": "object",
      "required": [
        "report_valid",
        "submission_valid",
        "disclosures_complete",
        "paths_are_relative",
        "file_hashes_current",
        "ready_for_leaderboard_review"
      ],
      "properties": {
        "report_valid": {
          "const": true
        },
        "submission_valid": {
          "const": true
        },
        "disclosures_complete": {
          "const": true
        },
        "paths_are_relative": {
          "const": true
        },
        "file_hashes_current": {
          "const": true
        },
        "ready_for_leaderboard_review": {
          "const": true
        }
      }
    },
    "notes": {
      "type": "string"
    }
  }
}
